{
  "video": {
    "id": "8s6nGMcyr7k",
    "title": "Google and Coinbase launch \"AI MONEY\" ü§Ø",
    "description": "The latest AI News. Learn about LLMs, Gen AI and get ready for the rollout of AGI. Wes Roth covers the latest happenings in the world of OpenAI, Google, Anthropic, NVIDIA and Open Source AI.\n\n______________________________________________\nMy Links üîó\n‚û°Ô∏è Twitter: https://x.com/WesRothMoney\n‚û°Ô∏è AI Newsletter: https://natural20.beehiiv.com/subscribe\n\nWant to work with me?\nBrand, sponsorship & business inquiries: wesroth@smoothmedia.co\n\nCheck out my AI Podcast where me and Dylan interview AI experts:\nhttps://www.youtube.com/@Wes-Dylan\n______________________________________________\n\n\n\n#ai #openai #llm",
    "author": "Wes Roth",
    "publishDate": "2025-09-17T20:56:28.000Z",
    "duration": 1440,
    "viewCount": 27513,
    "likeCount": 1195,
    "category": "Education",
    "thumbnails": [
      {
        "url": "https://i.ytimg.com/vi/8s6nGMcyr7k/hqdefault.jpg?sqp=-oaymwEmCKgBEF5IWvKriqkDGQgBFQAAiEIYAdgBAeIBCggYEAIYBjgBQAE=&rs=AOn4CLDARmDVo9eBjwTDAhEs-uSZqAknrQ",
        "width": 168,
        "height": 94
      },
      {
        "url": "https://i.ytimg.com/vi/8s6nGMcyr7k/hqdefault.jpg?sqp=-oaymwEmCMQBEG5IWvKriqkDGQgBFQAAiEIYAdgBAeIBCggYEAIYBjgBQAE=&rs=AOn4CLBEI21Y5wBJQx9BMSlGD5VMEdvubg",
        "width": 196,
        "height": 110
      },
      {
        "url": "https://i.ytimg.com/vi/8s6nGMcyr7k/hqdefault.jpg?sqp=-oaymwEnCPYBEIoBSFryq4qpAxkIARUAAIhCGAHYAQHiAQoIGBACGAY4AUAB&rs=AOn4CLDm-xkO91azERXSS-3dgzAsyVPfWg",
        "width": 246,
        "height": 138
      },
      {
        "url": "https://i.ytimg.com/vi/8s6nGMcyr7k/hqdefault.jpg?sqp=-oaymwEnCNACELwBSFryq4qpAxkIARUAAIhCGAHYAQHiAQoIGBACGAY4AUAB&rs=AOn4CLCX3QnUYWLz7B5aRhxcDeTuYW5BXg",
        "width": 336,
        "height": 188
      },
      {
        "url": "https://i.ytimg.com/vi_webp/8s6nGMcyr7k/maxresdefault.webp",
        "width": 1920,
        "height": 1080
      }
    ]
  },
  "channel": {
    "id": "UCqcbQf6yw5KzRoDDcZ_wBSw",
    "title": "Wes Roth",
    "description": "Artificial Intelligence, AI, Machine Learning, Google DeepMind, OpenAI, ChatGPT, Anthropic, Tech, Coding, AI News, Large Language Models and... (most importantly)... optimism. \n\nAGI rolls around only once. Let's make the best of it.\n\nOn this channel, my goal is to help everyone understand AI and it's implications better. To prepare for what's coming next.\n\nThe most important rule is \"Don't Panic\".\n\nThe second rule is keep learning.\n\nThank you for joining me for this ride.\n\n-Wes Roth\n\nWant to work with me?\nBrand, sponsorship & business inquiries: wesroth@smoothmedia.co\n",
    "subscriberCount": 296000,
    "avatar": {
      "url": "https://yt3.googleusercontent.com/DBBVMr7VodH_Y5y67c6X7apjoJLNxCHWXCHfjAHy2bep29hgM-Q_oDVkEururWHDii_S8S8l=s900-c-k-c0x00ffffff-no-rj",
      "width": 900,
      "height": 900
    }
  },
  "transcript": [
    {
      "start": 160,
      "end": 2159,
      "text": "So, Google just partnered up with"
    },
    {
      "start": 2159,
      "end": 5600,
      "text": "Coinbase to create a sort of a virtual"
    },
    {
      "start": 5600,
      "end": 8240,
      "text": "economy for AI agents. So, a lot of"
    },
    {
      "start": 8240,
      "end": 10400,
      "text": "people have speculated that this was"
    },
    {
      "start": 10400,
      "end": 12880,
      "text": "coming, that AI agents will need their"
    },
    {
      "start": 12880,
      "end": 15599,
      "text": "own currency, their own way to pay for"
    },
    {
      "start": 15599,
      "end": 17760,
      "text": "services so that they're able to acquire"
    },
    {
      "start": 17760,
      "end": 20080,
      "text": "resources and go out there and get stuff"
    },
    {
      "start": 20080,
      "end": 22160,
      "text": "done. You've probably heard this idea"
    },
    {
      "start": 22160,
      "end": 25359,
      "text": "talked about before, but it's here. And"
    },
    {
      "start": 25359,
      "end": 27680,
      "text": "I for one got caught off guard just a"
    },
    {
      "start": 27680,
      "end": 29760,
      "text": "little bit because I didn't expect it to"
    },
    {
      "start": 29760,
      "end": 32960,
      "text": "be here this fast. So Brian Armstrong is"
    },
    {
      "start": 32960,
      "end": 36239,
      "text": "the co-founder and CEO at Coinbase. Now"
    },
    {
      "start": 36239,
      "end": 39760,
      "text": "Coinbase is a crypto trading platform."
    },
    {
      "start": 39760,
      "end": 42000,
      "text": "So why is it partnering up with Google?"
    },
    {
      "start": 42000,
      "end": 43520,
      "text": "Well, just a few days ago, Google"
    },
    {
      "start": 43520,
      "end": 46719,
      "text": "DeepMind published this big paper. What"
    },
    {
      "start": 46719,
      "end": 50079,
      "text": "is this big paper about? It's about"
    },
    {
      "start": 50079,
      "end": 53360,
      "text": "virtual agent economies. Here's the key"
    },
    {
      "start": 53360,
      "end": 56480,
      "text": "part. The rapid adoption of autonomous"
    },
    {
      "start": 56480,
      "end": 59039,
      "text": "AI agents is giving rise to a new"
    },
    {
      "start": 59039,
      "end": 62160,
      "text": "economic layer where agents transact and"
    },
    {
      "start": 62160,
      "end": 65198,
      "text": "coordinate at scales and speeds beyond"
    },
    {
      "start": 65199,
      "end": 67680,
      "text": "direct human oversight. So again, not a"
    },
    {
      "start": 67680,
      "end": 70799,
      "text": "new idea, but it just feels like it's"
    },
    {
      "start": 70799,
      "end": 73119,
      "text": "here a little bit ahead of schedule. And"
    },
    {
      "start": 73119,
      "end": 75360,
      "text": "notice for the keywords, they do mention"
    },
    {
      "start": 75360,
      "end": 77840,
      "text": "blockchain. Now, a lot of people are"
    },
    {
      "start": 77840,
      "end": 80240,
      "text": "probably hesitant to mess around with"
    },
    {
      "start": 80240,
      "end": 82400,
      "text": "crypto and the blockchain just because"
    },
    {
      "start": 82400,
      "end": 85119,
      "text": "of the sheer amount of scams and various"
    },
    {
      "start": 85119,
      "end": 87680,
      "text": "shenanigans and various shenanigans that"
    },
    {
      "start": 87680,
      "end": 90400,
      "text": "got pulled with crypto and cryptoreated"
    },
    {
      "start": 90400,
      "end": 92320,
      "text": "projects. But a lot of that had to do"
    },
    {
      "start": 92320,
      "end": 94960,
      "text": "with just the possibility of speculating"
    },
    {
      "start": 94960,
      "end": 97759,
      "text": "on prices going up and down. This, as"
    },
    {
      "start": 97759,
      "end": 100079,
      "text": "far as you can tell, is completely"
    },
    {
      "start": 100079,
      "end": 102400,
      "text": "separated from that. So, we're not"
    },
    {
      "start": 102400,
      "end": 104560,
      "text": "talking about any tokens that you can"
    },
    {
      "start": 104560,
      "end": 106960,
      "text": "bet on. We're just talking about some"
    },
    {
      "start": 106960,
      "end": 109439,
      "text": "sort of a payment system that can be"
    },
    {
      "start": 109439,
      "end": 112560,
      "text": "carried out away from the dollar, away"
    },
    {
      "start": 112560,
      "end": 114560,
      "text": "from, you know, needing Visa and the"
    },
    {
      "start": 114560,
      "end": 116960,
      "text": "credit cards companies to transact those"
    },
    {
      "start": 116960,
      "end": 118640,
      "text": "things. Something that can be done very"
    },
    {
      "start": 118640,
      "end": 120880,
      "text": "fast, done automatically by AI agents"
    },
    {
      "start": 120880,
      "end": 122640,
      "text": "and something that can be very, very"
    },
    {
      "start": 122640,
      "end": 124719,
      "text": "transparent. So, none of this is for you"
    },
    {
      "start": 124719,
      "end": 126159,
      "text": "to buy anything. None of this is going"
    },
    {
      "start": 126159,
      "end": 128560,
      "text": "to the moon, nothing like that. But"
    },
    {
      "start": 128560,
      "end": 130080,
      "text": "let's take a look at what it actually"
    },
    {
      "start": 130080,
      "end": 132080,
      "text": "is. So, this is Coinbase. They're saying"
    },
    {
      "start": 132080,
      "end": 134560,
      "text": "Google Agentic Payments Protocol. So, I"
    },
    {
      "start": 134560,
      "end": 136879,
      "text": "guess they're calling it X42."
    },
    {
      "start": 136879,
      "end": 138080,
      "text": "So, if you're not aware of the"
    },
    {
      "start": 138080,
      "end": 139520,
      "text": "background, there's a lot of these"
    },
    {
      "start": 139520,
      "end": 141599,
      "text": "protocols that are being built out right"
    },
    {
      "start": 141599,
      "end": 145280,
      "text": "now for various AI systems to interact"
    },
    {
      "start": 145280,
      "end": 148400,
      "text": "with one another. MCP was the model"
    },
    {
      "start": 148400,
      "end": 151040,
      "text": "context protocol that was an open-source"
    },
    {
      "start": 151040,
      "end": 154000,
      "text": "protocol by Anthropic and just allows"
    },
    {
      "start": 154000,
      "end": 156400,
      "text": "the various large language models and"
    },
    {
      "start": 156400,
      "end": 159360,